<?xml version = '1.0' encoding = 'UTF-8'?>
<ns0:resumen xmlns:ns0="http://www.example.org" xmlns:xsi="http://www.w3.org/2001/XMLSchema-instance" xsi:schemaLocation="http://www.example.org file:/C:/JDeveloper/mywork/HolaMundoApp/HolaMundo/SOA/xsd/VentaArticuloSchema.xsd">
   <ns0:articulos>
      <ns0:articulo>
         <ns0:id/>
      </ns0:articulo>
      <ns0:articulo>
         <ns0:id/>
      </ns0:articulo>
      <ns0:articulo>
         <ns0:id/>
      </ns0:articulo>
   </ns0:articulos>
</ns0:resumen>
